{
  "schema_version": 1,
  "id": "the-morning-after",
  "title": "The Morning After",
  "author": "oleg",
  "summary": "The lights are back. Nobody has gone home.",
  "requires": [
    { "flag": "ziggys_chapter_zero.closing_decision", "equals": "organize" }
  ],
  "cast": ["caroline", "oleg", "tonya", "grant"],
  "beats": [
    { "id": "settle", "kind": "ambience", "preset": "warm" },
    { "id": "the_call", "kind": "lighting", "preset": "brownout", "after": { "conversations": 3 } },
    { "id": "decide", "kind": "decision", "npc": "caroline",
      "after": { "conversations": 3, "since": "the_call" },
      "writes": "ziggys.the-morning-after.decision",
      "choices": ["stay_open", "call_it", "split_the_tab", "wait"] },
    { "id": "wrap", "kind": "end", "after": { "conversations": 1, "since": "decide" } }
  ]
}
